goid,publisher,date,article_type,section,tdm_topic_tags,page,word_count,title,paragrph_text,company_name,is_economic,bert_sentiment,paragraph_avg_positive,paragraph_avg_neutral,paragraph_avg_negative,tf_idf_tags,tf_idf,roberta_title_negative,roberta_title_neutral,roberta_title_positive
422115807,Los Angeles Times,2006-12-16,News,Main News; Part A; National Desk,,A.2,124,For the Record,"[""correction: see correction appended; silicon: in a for the record item that ran dec. 16 and in wednesday's food section, silicon was referred to as a compound. it is an element.; silicon: in a for the record item that ran dec. 16 and in the dec. 20 food section, silicon was referred to as a compound. it is an element."", ""baking sheet liners: in an article in wednesday's food section about preparing cookie sheets, the word silicone, a compound used in manufacturing silpat and other pan liners as well as baker's parchment paper, was misspelled as silicon, a different compound."", 'message no: 67412']",,1,-0.9796035885810852,0.0203964433943231,0.0,0.9796035885810852,"['silicon', 'compound', 'liners', '67412', 'dec', 'silpat', 'section', 'element', 'item', 'food', 'correction', 'referred', 'record', 'silicone', 'parchment']",,,,
422212886,Los Angeles Times,2008-07-07,News,Main News; Part A; Editorial Pages Desk,Social promotion,A.12,243,School's efforts should be praised,"['re ""scientology link rouses worries at star\'s school,""', 'june 29', 'the times writes, ""one teaching method the school uses is study technology, which was developed by [scientology founder l. ron hubbard] and focuses on students gaining hands-on experience, mastering subject matter before moving to the next level, and being taught not to read past words they don\'t understand.""', 'this technique has been used by good teachers for centuries. while hubbard may have come up with the jargon ""study technology,"" he did not invent the ideas of hands-on experience, mastering subject matter before moving to the next level and being taught not to read past words the student doesn\'t understand.', 'maybe one of the reasons our educational system is in trouble is that we have allowed students to move on with neither knowledge nor skills. it\'s called ""social promotion."" i don\'t think hubbard is responsible for it.', 'monroe pastermack', 'the times regularly publishes articles describing the poor performance of the public education system at great taxpayer expense.', 'therefore, will and jada smith putting their time and money on the line to change things through an innovative school should make a great story. instead, you offer an innuendo-filled piece about the religious beliefs and educational methods of some of the teachers.', ""the times won't say it, so i will: three cheers for the smiths and the new village academy!"", 'nick mcnaughton', 'los angeles']",,1,0.2255872704766013,0.589223542946539,0.0,0.4107764750528572,"['hubbard', 'scientology', 'mastering', 'pastermack', 'school', 'educational', 'rouses', 'mcnaughton', 'taught', 'teachers', 'smiths', 'jada', 'subject', 'technology', 'innuendo']",,,,
422216858,Los Angeles Times,2007-10-04,News,California; Part B; Metro Desk,,B.1,726,ACLU faults decision on group; Letter to Chapman University says Jewish fraternity should get OK to recruit on campus.,"['chapman university officials violated the constitutional rights of students who were trying to form a jewish fraternity when they ordered the men not to recruit on campus or wear t-shirts promoting sigma alpha mu, according to a letter the aclu sent university officials tuesday.', '""chapman, we have a problem,"" said hector villagra, director of the orange county office of the american civil liberties union of southern california. ""these students have free speech rights.""', 'the fraternity organizer, pascal de maria, now a senior, said he did not believe anti-semitism was involved.', 'chapman spokeswoman mary platt said the letter was under review and that some student contentions were untrue, such as being prohibited from wearing fraternity t-shirts.', '""they\'ve been wearing those shirts all semester. there has been no action taken. that\'s ridiculous,"" she said. ""the university\'s only aim throughout all this is to assure that this group, as with any group, does not call itself an officially sanctioned chapman organization when it\'s not, because . . . it leaves the university with considerable liability.""', ""the controversy's roots are more than 2 years old, when de maria and some friends decided to create a campus chapter of sigma alpha mu, a historically jewish fraternity. the students began recruiting members and meeting with university officials in spring 2005 about the application process. in april 2006, the university allowed a fraternity to set up on campus but turned down several, including sigma alpha mu."", 'at the same time, the group\'s national organization gave the students ""colony"" status, a step below chapter status, and the chapman students began wearing t-shirts emblazoned with the greek letters on campus.', 'in september 2006, joseph kertes and administrator chris hutchinson sent de maria a letter ordering him to stop advertising fraternity events on campus and forbade him to hold fraternity events on campus or meeting at chapman before heading to off-campus events.', 'they also said the group must clearly indicate that it is not affiliated with chapman and request that the national organization send a letter to university officials stating that there is no chapter at the campus, and to agree to carry insurance coverage for chapman students who associate with the local fraternity.', ""the letter was sent to several administrators, as well as the leaders of the university's sanctioned fraternities and sororities."", 'chapman also sent leaders of these groups letters urging them to report to university officials if de maria or the other sigma alpha mu members were seen congregating on campus or wearing their t- shirts, villagra said.', '""i felt like a prisoner at the school i go to,"" de maria said.', ""platt said she could not comment on the september 2006 letter because it would violate de maria's privacy rights."", ""the university's decision to distribute the letter to other students is the subject of a complaint de maria filed with the federal government."", 'she said the group was offered the option of becoming a school club, which is a much simpler process than becoming a fraternity.', 'the only difference is that the group would have to admit any man or woman who applied, she said.', ""the aclu letter does not question the university's decision to deny the group its imprimatur but seeks a retraction of the restrictions in the september 2006 letter, as well as expunging students' records of anything relating to the fraternity issue."", 'villagra said that the restrictions were applied only to sigma alpha mu and not to any other unauthorized group that claims a chapman affiliation, such as the assn. of intellegentpot smokers and the under age drinkers (cu chapter), both of which assert school affiliation on their facebook pages.', 'platt said university officials lacked the resources to police the internet.', 'villagra said if the university failed to act, the aclu would consider suing.', 'de maria said he would be happy if his group could do what other fraternal groups do -- play ultimate frisbee on the quad and hold meetings, charity benefits and social events.', '""we have no intention of making the university angry or provoking them,"" he said.', '""we really just wanted to associate ourselves with a brotherhood.""']",,1,-0.9797776807909426,0.0202221820654813,0.0,0.9797778310983076,"['fraternity', 'chapman', 'campus', 'villagra', 'mu', 'university', 'sigma', 'letter', 'maria', 'alpha', 'students', 'aclu', 'shirts', 'group', 'platt']",,,,
422225372,Los Angeles Times,2008-04-28,News,Sports; Part D; Sports Desk,Professional basketball,D.4,594,WESTERN CONFERENCE PLAYOFFS; Hornets put the Mavericks in familiar spot,"['david west hardly said a word the last two days. that meant trouble for the dallas mavericks.', 'west let out his pent-up frustration over a poor game 3 with a determined effort in game 4, scoring 10 of his 24 points in a quick stretch early in the second half to help the new orleans hornets pull away for a 97-84 victory sunday and a 3-1 lead in the best-of-seven western conference first-round series that put the mavericks on the brink of a second straight early exit.', '""everything was stirring up in him,"" coach byron scott said of west who had 14 points on six-of-20 shooting in game 3. ""he wasn\'t going to play the way he played in game 3. we were banking on that. he was in an aggressive mind-set from the start and he came up big.""', ""the hornets hadn't won in dallas over 14 tries since january 1998. this victory means they might not have to come back until next season. they can eliminate the mavericks by winning game 5 tuesday night in new orleans."", ""dirk nowitzki had 22 points and 13 rebounds and jason terry scored 20 points, but they didn't get much help. josh howard made only three of 16 shots, and jason kidd had three points, three assists and four rebounds before getting ejected with 7:16 left for a flagrant foul on jannero pargo. a fan was also ejected in owner mark cuban's row."", ""coach avery johnson's mavericks went from scoring 30 points in the first quarter to 40 in the entire second half."", '""i don\'t really have an answer for it,"" said nowitzki, exhaling loudly and running his hand through his hair in frustration. ""all season long, we\'ve lost leads way too quick. . . . everybody has to be in attack mode. you have to make shots to win in this league.""', 'phoenix 105, san antonio 86 -- a frenchman put the suns on the brink of elimination, another brought the suns back to life.', 'boris diaw, starting in place of grant hill (abdominal strain), had 20 points, 10 rebounds and eight assists to help the suns avoid a first-round sweep in the series, which the spurs now lead, 3-1.', '""i trust him. i always have,"" suns coach mike d\'antoni said. ""i think he\'s a heck of a basketball player. he\'s been maligned here a little bit, but he can play. he stepped up big.""', ""diaw also played tough defense on his good friend and fellow frenchman tony parker, who scored 18 points after 41 in san antonio's 115-99 victory friday in game 3."", '""i think they kind of relaxed being up 3-0,"" diaw said, ""but we came out and played too. we didn\'t come out like the series was over. we came out fired up.""', ""no one was more aggressive than raja bell, who scored 21 of his 27 points in a dominant first half to help phoenix bring a one-sided end to the defending nba champions' nine-game playoff winning streak."", '""we didn\'t expect to sweep these guys,"" said the spurs\' tim duncan, who scored 14 points. ""we\'re excited in the situation we\'re in, up 3-1. we\'ve got to win one more game, and we get to go home and try to win it there.""', ""caption: photo: on the rise: the hornets' hilton armstrong, right, seems up to the challenge on this dirk nowitzki shot.; photographer:larry w. smith epa""]",Dallas Mavericks,1,0.5646233717600505,0.7646233657471991,0.0,0.2353766244176464,"['mavericks', 'points', 'diaw', 'hornets', 'suns', 'nowitzki', 'game', 'scored', 'frenchman', 'rebounds', 'dirk', 'ejected', 'spurs', 'brink', 'sweep']",,,,
422244463,Los Angeles Times,2010-01-18,News,Main News; Part A; Foreign Desk,Presidency,A.17,785,"In Ukraine, race for presidency will go to runoff","['viktor yanukovich, the burly former mechanic ousted by popular revolt just five years ago, salvaged himself to claim top place among contenders for the ukrainian presidency sunday, exit polls indicated.', 'his longtime rival, prime minister yulia tymoshenko, will be a close second, the survey predicted. the exit poll results, if borne out by the slow counting of ballots, mean that the contentious pair will battle for the presidency in a runoff next month.', ""the choice of a new leader marks a milestone in ukraine's post-soviet evolution, and many voters appeared disillusioned and hungry for change -- if wary of fresh rounds of infighting and scrapping for power among the ukrainian elite."", ""a survey from the widely respected national exit poll consortium gave yanukovich 31.5% of the vote to tymoshenko's 27.2%, topping a field of 18 candidates. a runoff will be held because no candidate received more than 50% of the vote."", ""within hours of the polls closing sunday night, the leading candidates were already scrambling to pick up as many of the losing candidates' votes as possible. many analysts believe tymoshenko, 49, will have the advantage in gaining votes in the second round."", 'tymoshenko strode into a news conference grinning from ear to ear and launched into a blistering criticism of yanukovich, 59, calling him the stooge of ""criminals and oligarchs."" she called upon all ukrainians who voted for ""democratic"" candidates to throw their support behind her.', '""i\'m telling those who voted for other democratic candidates, we now have the chance to do what we could never do in the past: to unite all the democratic forces in the country,"" tymoshenko said. ""i\'m ready to excuse every democratic candidate for the things they said about me. i\'m ready to turn that page.""', 'yanukovich soon chimed in with similar appeals to voters. ""they thought they could make promises from election to election and not fulfill the promises, that people will forget,"" he said of tymoshenko and her allies.', ""the improbable reversal of yanukovich's fortune points up the changes that have rattled ukraine in past years."", 'the last time ukrainians voted for a president, in 2004, yanukovich won but his victory was tarnished by allegations of vote rigging. enraged crowds stormed into the streets to demand his ouster, and the orange revolution was born.', 'the ensuing seasons have been tumultuous and often painful for ukraine. the politicians who had marched boldly through the frigid streets calling for a reinvented ukraine were now in office -- and promptly lost themselves in byzantine power plays, internecine wars and flashy shows of dubiously acquired wealth.', 'meanwhile, the economic crisis under president viktor yushchenko has hammered the country, radically devaluing the currency and spreading unemployment and uncertainty throughout the provinces.', '""people are feeling that they\'ve been lied to,"" said larisa kuchuba, a 60-year-old engineer who braved snow and thick blankets of black ice sunday to vote in south kiev.', ""kuchuba cast her vote for one of the lesser-known opposition candidates. she didn't believe he stood the slightest chance of winning; her vote was cast in protest, she said."", '""the politicians did everything to keep one another from succeeding. they didn\'t do anything for the success of the country,"" she said. ""all they did was fight.""', 'analysts warned that the presidency would be a bitterly fought-for prize, with the candidates accusing one another of fraud and going to court. the battle could drag on for months beyond the runoff.', 'with the exit of yushchenko, whose approval ratings wallowed in the single digits in recent months, ukraine loses a president who strove to shake off the grip of moscow and reorient ukraine as a westernized land with strong allies in brussels and washington.', ""but in a country where many people grow up speaking russian and feel nostalgically, culturally and religiously intertwined with russia, yushchenko's approach chafed nerves -- and eventually backfired as his opponents blamed him for the dangerous deterioration of relations with moscow."", 'the kremlin now appears poised to restore some of its lost influence in ukraine because both leading candidates have friendly relations with russian leaders.', 'in the years since the orange revolution, the very word ""orange"" lost its linguistic role as proud shorthand for the leaders who presented themselves as pro-western reformers and became an adjective generally uttered with a grimace or a roll of the eyes.', 'its affections historically split between russia and europe, ukraine became a coveted battleground for influence between russia and the u.s., which heartily backed its drift away from moscow.', 'but even that status was lost: ukraine found its foreign policy importance downgraded as president obama sought to ease tensions with the kremlin.']",,1,-0.2691788456656716,0.3671849867598873,0.0,0.6328150080252354,"['yanukovich', 'tymoshenko', 'ukraine', 'candidates', 'yushchenko', 'kuchuba', 'runoff', 'vote', 'exit', 'presidency', 'moscow', 'democratic', 'ukrainians', 'viktor', 'russia']",,,,
422244975,Los Angeles Times,2008-11-02,General Information,Sunday Calendar; Part E; Calendar Desk,,E.2,39,For the record,"['""mad men"" actress: a caption under photographs last sunday of ""mad men"" actors jon hamm and elisabeth moss incorrectly gave her last name as olson, her character\'s last name.']",,1,-0.9984474778175354,0.0015525779454037,0.0,0.9984474778175354,"['mad', 'hamm', 'elisabeth', 'olson', 'men', 'moss', 'incorrectly', 'actress', 'jon', 'actors', 'photographs', 'character', 'gave', 'record', 'sunday']",,,,
422341989,Los Angeles Times,2008-07-12,News,California; Part B; Metro Desk,Television programs,B.3,881,"On L.A.'s Melrose, a new sense of place; The quiet, tree-lined shopping destination is in the midst of an upscale shift that has some feeling left out.","['the tree-lined block that juts out of la cienega boulevard just above melrose avenue is a bit of a retail oddity for los angeles: a quiet, quaint address in the middle of the bustling city.', 'and as such, melrose place -- not the fictional location of the television show with the same name but rather the concrete-and-ivy street with nary an apartment building in sight -- has always been a destination for a certain kind of shopper, the kind of person who might employ a decorator, a stylist or both.', 'but what they are seeking has changed dramatically in recent years. melrose place, like so many parts of the city, is in the throes of an upscale shift that has some feeling left out.', ""once a residential street, then a destination for high-end antiques and home-furnishing stores, melrose place has in recent years become a fashion lover's mecca."", 'by most accounts, the transformation began a little more than three years ago, when marc jacobs and marni moved onto the block in quick order. they were followed by other upscale retailers, including carolina herrera, sergio rossi, mulbery and lambertson truex.', 'but as the fashionistas swept in, many of the antique stores that had called the place home began moving elsewhere, some bemoaning the rapidly rising rents and others the loss of the chummy camaraderie they once enjoyed.', '""i used to know everybody on the street, and people were friendly,"" said rose tarlow, who opened her first antique store on the block in 1976. ""now, i don\'t even go out the front door. it\'s very different."" tarlow has decided to move off the block and rent out the two buildings that she owns.', '""it used to be beautiful,"" ahmad ahmadi, the owner of ariana rugs, said with a sigh. ""it was all antique mom-and-pop stores, high-end interiors from floor coverings to furniture to fabrics. it was really a destination for a lot of international decorators.""', 'ahmadi said he was leaving the area after a decade on the street because his landlord had increased his rent from $4 a square foot per month to $25. ""they are forcing me out,"" ahmadi said. ""the amount of money they are asking -- how can i afford it?""', ""melrose place came of age in the 1960s and '70s, said historian marc wanamaker, when the demand for retail space for high-end antique stores along la cienega overflowed to the street. because it was a little more isolated, melrose place became a cheaper place to buy into, wanamaker said, and the area quickly became a district all its own."", 'antique stores along the street featured furniture and other home furnishings from the 18th and early 19th century, wanamaker said: ""the quality of their works of art was absolutely impeccable. . . . you could go in there and you could trust them. they were not going to rip you off. they would be catering to connoisseurs, not just someone decorating a house. from the \'70s, to the \'80s and \'90s, melrose place would have that reputation.""', 'many of the original antique dealers were gay men or couples who retired and then died, leaving no family members to carry on the business, wanamaker said. after the first fashion stores moved in, other ""owner-operators"" chose to take advantage of surging prices along the street, sell their buildings and move their home-furnishings businesses elsewhere.', '""it just ended,"" wanamaker said. ""an era ended. that\'s how you can say that.""', 'michael shabani, whose family has for more than four decades owned the building marc jacobs moved into, said that much of the shift has been deliberate on the part of landlords, who ""identify areas we feel fashion tenants will like. . . . this was just bound to happen.""', 'but some landlords and tenants say that the recent shift has been driven by the buying power of one organization: the nasa group, a collection of silent partners who claim they control 60% of the property on the block, either as owners or long-term leasers. property records show that limited-liability corporations tracing back to nasa own seven buildings on the block.', 'samantha feld, a broker who does leasing, sales and acquisitions for nasa and acts as its spokeswoman, said that the fascination with melrose place began three years ago, when the company purchased a building at 8428 melrose place. ""we felt [it] was really charming,"" she said. ""we had never been to the street before. but it has a unique feeling to it. all of the buildings have so much character.""', 'part of that building is now leased out to bird, a fashion firm that moved from robertson boulevard two years ago for many of the same reasons.', 'caption: photo: empty space: pedestrians walk past a store for lease on melrose place. once a destination for high-end antiques and home-furnishing stores, the street has become a fashion lover\'s mecca.; photographer:genaro molina los angeles times; photo: customer: tina ghods, who works nearby, waits for her take-out order in front of a restaurant on melrose place. ""it\'s becoming a trendy area, that\'s for sure,"" she said.; photographer:genaro molina los angeles times']",,1,0.1961555083592732,0.5850443271338008,0.0,0.4149556882168528,"['melrose', 'wanamaker', 'antique', 'place', 'stores', 'street', 'ahmadi', 'destination', 'fashion', 'block', 'tarlow', 'said', 'nasa', 'buildings', 'shift']",,,,
734750209,Los Angeles Times,2010-08-04,General Information,Calendar; Part D; Entertainment Desk,,D.3,113,QUICK TAKES; Bieber's career rates film too,"['a day after the announcement that he was writing a memoir, paramount pictures, mtv films and island def jam said tuesday that 16-year-old singer justin bieber has signed on to appear in a feature film about his life and career.', 'the yet-to-be-titled movie is set for release on ""valentine\'s weekend"" of 2011, the companies said.', 'it will offer a ""vip backstage pass"" into bieber\'s life and will feature 3-d footage from his ""my world 2.0"" concert tour.', 'bieber will also be producing the film, along with mentor usher, manager scooter braun and island def jam music group chairman l.a. reid.']",,1,0.520321860909462,0.7703217342495918,0.0,0.2296782640041783,"['bieber', 'def', 'jam', 'film', 'feature', 'island', 'scooter', 'vip', 'braun', 'usher', 'backstage', 'career', 'valentine', 'mtv', 'paramount']",,,,
